,city,name,reviews,rating,review_id,review_text,review_rating,review_datetime_utc
1175,Edmonton,Koultures Afro-Continental Restaurant,287,3.7,ChZDSUhNMG9nS0VJQ0FnSUNleW9MMkF3EAE,"A Very relaxed atmosphere and the food was Absolutely delicious! I had the Pounded Yam (fufu) & Soup along with the King Fish and Jollof Rice. I really enjoyed my meal and would recommend Koultures for anyone interested in trying/wanting Nigerian or Ethiopia cuisine.

Next visit I will try another entrée from their menu but I will most likely get the pounded yam & Soup everytime as a starter.",5,9/11/2022 2:23
1176,Edmonton,Koultures Afro-Continental Restaurant,287,3.7,ChZDSUhNMG9nS0VJQ0FnSURKcTdpb1RBEAE,The place is beautiful and food taste really good????,4,7/22/2023 23:01
1177,Edmonton,Koultures Afro-Continental Restaurant,287,3.7,ChZDSUhNMG9nS0VJQ0FnSUQyN3JucEt3EAE,"I visited this restaurant with my friends yesterday and was it such an experience! Great music, great communication, awesome reception, cozy ambience! I lovedddd the ambience there!

Nobody complained when we laughed so loud, like, all through the meal or talked loud! The table server was such a courteous person! I wish I got his name so that I could thank him here. But we will definitely be going there again!! And again, and again!!

Now, the food. I had Jollof Rice. It was packed with flavour. Amazing food! It was my first experience with an African cuisine and boy oh boy it was worth!

The lighting, paintings displayed on walls, oh the total ambience!

This place is a must visit. Go there NOW!",5,5/15/2022 14:10
1178,Edmonton,Koultures Afro-Continental Restaurant,287,3.7,ChZDSUhNMG9nS0VJQ0FnSUQ2dWVQZExnEAE,"You order in advance to pick up at a certain time and when you arrive at that said time, youre stared at like you make no sense. It took two people to figure out what I ordered IN ADVANCE on DoorDash. I ordered in advance by 1.5 hours to avoid waiting cause they never have anything ready on time. Then I had to wait almost 45 minutes to receive the order. The food was so poorly packaged, 50% of the soup spilled out cause they used very flimsy containers. You ask for mild and they make it as spicy as they want.

Ive been here several times hoping each time theres is improvement but the customer service is zero. Poor attitudes, extra charges, longest wait and no acknowledgment of the customer. Plus, dirty looks while youre waiting or as youre paying. Ridiculous!",1,10/5/2021 0:31
1179,Edmonton,Koultures Afro-Continental Restaurant,287,3.7,ChZDSUhNMG9nS0VJQ0FnSUNvLXJfZ0h3EAE,"Been there twice and will go back many more times!
The service is not the fastest, but they are friendly and welcoming. Also keep in mind good food takes time to prepare.
I'm new to African food in general so I wasnt sure what to expect. The food was spectacular! I have no idea what most of it was but it was so flavorful and fresh. Their veggie platter is a must have. I also got a sizzling fried beef dish that I could not stop eating. The complimentary desert was also much appreciated! The price was worth it for the portions we received. I had to loosen my belt and waddle out of the restaurant with a big smile on my face. Worth a visit!",5,2/12/2019 17:01
1180,Edmonton,Koultures Afro-Continental Restaurant,287,3.7,ChdDSUhNMG9nS0VJQ0FnSUNXa1luVXJnRRAB,"I love the Suya Meat , its all I really go for and I do delivery every time. I love this particular dish but cant speak on anything else. The interaction with the employees was pretty basic ordered my food and left. Suya is delicious ??",5,3/1/2022 6:27
1181,Edmonton,Koultures Afro-Continental Restaurant,287,3.7,ChdDSUhNMG9nS0VJQ0FnSURCcmFQWnBnRRAB,The fufu with the Nigerian veggie soup from there is my fav so far 10/10 its so goood and super filling?? I ordered it again rn on ubereats,5,1/26/2023 3:39
1182,Edmonton,Koultures Afro-Continental Restaurant,287,3.7,ChZDSUhNMG9nS0VJQ0FnSURHNlBUS1h3EAE,"What a rip off. We order a couple of there dishes online for delivery which included goat stew combo, 30 minutes after placing the order they called to inform they didn't have the side dish we had ordered so they suggested a beverage for replacement which happened to be way less valued/priced than the original item. Then we didn't get the goat combo but rather some tasteless beef stew. And to top it off my boyfriend got food poisoning from his order. So much for cravings, never again!",1,11/17/2021 3:18
1183,Edmonton,Koultures Afro-Continental Restaurant,287,3.7,ChZDSUhNMG9nS0VJQ0FnSUMybk5HUUJnEAE,Nah do you know how mad I gotta be to be typing this up at 11pm but hands down one of the worst food experience Ive had in my entire life. Order food for 4 people and only got one order. And they charged me 65 dollars. Please I beg dont order from this place they are scamming. Enough said. Have a good night everyone expect the people that either make the food here or deliver it. One of all owe me money or food Ill take either.,1,4/15/2022 4:52
1184,Edmonton,Koultures Afro-Continental Restaurant,287,3.7,ChdDSUhNMG9nS0VJQ0FnSURtM3VlaGl3RRAB,"Last night I ordered the Egusi soup (with beef) and pounded yam. When I say that the flavour in this food almost knocked me over, Im not kidding. The Egusi was packed with flavour and had a very pleasant kick, but wasnt so spicy that it was inedible. The pounded yam was the perfect consistency to eat the meal with and was not over spiced or seasoned which would take away the flavour or the soup.

The beef in the Egusi was admittedly a little bit dry, but the flavour of it completely compensated for this. I will definitely order from this restaurant again.",5,1/29/2022 18:11
1185,Edmonton,Koultures Afro-Continental Restaurant,287,3.7,ChZDSUhNMG9nS0VJQ0FnSUR1bHVtRVVREAE,"This restaurant is the worst in Edmonton, the wait time is forever. The stuff is very rude and ignores you when you ask where your food is. Is amazing they are still open. We waited for over and hour and when we asked where our food was we were asked to just leave. Disrespectful.",1,8/20/2022 2:55
1186,Edmonton,Koultures Afro-Continental Restaurant,287,3.7,ChdDSUhNMG9nS0VJQ0FnSUNNN2RDV3FRRRAB,"Food was excellent and a great price for what you get. It came within a good time as well, although the two dishes didn't come at once.

Service was friendly but far more casual than I expected for a place that looks like its fine dining, and a little slow.

Disappointed that much of their vegetarian options have been removed from the menu and it would be great if they had a drink menu to order from.",4,12/1/2019 3:03
1187,Edmonton,Koultures Afro-Continental Restaurant,287,3.7,ChdDSUhNMG9nS0VJQ0FnSURSdWJIWmhnRRAB,"I recommend the restaurant!!! The service, food everything was amazing!!!",5,4/29/2023 6:55
1188,Edmonton,Koultures Afro-Continental Restaurant,287,3.7,ChdDSUhNMG9nS0VJQ0FnSUNHM09MYnhBRRAB,I had their jollof and it was great. Portion sizes were great and the food was fresh. They have a really mixed menu with west and East African cuisines which is sure to appease everyone. Definitely recommend,5,10/23/2021 4:45
1189,Edmonton,Koultures Afro-Continental Restaurant,287,3.7,ChZDSUhNMG9nS0VJQ0FnSURlc1BQMmR3EAE,"Customer service isnt good at all. Called in to complain that the quality of food dropped for my last order and her response was that shes busy and cant talk now.
Anyways, you have lost a customer.",3,9/30/2022 1:05
1190,Edmonton,Koultures Afro-Continental Restaurant,287,3.7,ChdDSUhNMG9nS0VJQ0FnSUNDbGIyZDRnRRAB,"I am generous with Asian single star rating, service was far below expectations. Food was served incorrectly after a long delay, I was incorrectly billed and almost made to pay for what I did not eat, the server got angry when I gave him my honest feedback. I do not wish any other person to go through my experience. I went there with my family visiting Edmonton, we were all disappointed",1,8/31/2020 0:05
1191,Edmonton,Koultures Afro-Continental Restaurant,287,3.7,ChdDSUhNMG9nS0VJQ0FnSURTNTdmbzR3RRAB,"We ordered the Nigerian dish with fufu and egusi. $24 and it wasnt as good as we thought.. also the portion was sooooo small... Expected much more for the price. The assorted meat was just tendon and pork skin...
Also ordered the rice that had 4 giant pieces of HARD beef..

Was very unimpressed with the expensive pricing for so little..
would not order again or recommend to friends.",1,1/12/2021 8:22
1192,Edmonton,Koultures Afro-Continental Restaurant,287,3.7,ChZDSUhNMG9nS0VJQ0FnSURtdjlQdGR3EAE,"The stars are deff for the food. Suya beef 100% love it!
I usually have trouble ordering over the phone...but the food was delicious. Crunchy meat and well seasoned! Will be back :)",5,2/14/2022 5:55
1193,Edmonton,Koultures Afro-Continental Restaurant,287,3.7,ChdDSUhNMG9nS0VJQ0FnSUNnMnRMWHhRRRAB,"As a tourist in Edmonton, longing for a taste of Nigerian or at least food, it was enough to read online about a restaurant that serves ""West African"" food. But to get to Koultures and find it was actually Nigerian food was exciting!

My family and I eagerly looked forward to the meals, hoping they would be close to Nigerian taste. Boy, were we so wrong! It wasn't close, it was a great hit on the bull's eye!!! The handsome, amiable and unassuming chef totally nailed it! Nigeria came alive in the heart of Edmonton!

The dishes were so fantastically prepared, and this is coming from someone who is not only particular about food being well prepared, but one who cooks too! The portions were delightfully generous, we were certain we would have several packs of food to go home with, but the food was way too tasty that we struggled to go home with barely anything!

Going to Koultures was one of the highlights of this trip for my family. We would definitely recommend Koultures to anyone who loves great food in a welcoming environment served by wonderful people with an altogether beautiful disposition!",5,4/15/2018 12:51
1194,Edmonton,Koultures Afro-Continental Restaurant,287,3.7,ChdDSUhNMG9nS0VJQ0FnSUNxeWJPaV9BRRAB,lm very not so happy and not pleased with the service on this place Is like I wasted my money (40$) on this foods i ordered two things which is not hard to forget I asked for pepper soup fish and nigeria jollof rice. that rice didnt even tasted like jollof. My fish wasnt even pepper soup but sending me fry fish like huh ? The whole reason I even ordered is because I saw pepper soup really disappointed !!!!!!!,1,6/11/2021 3:09
1195,Edmonton,Koultures Afro-Continental Restaurant,287,3.7,ChdDSUhNMG9nS0VJQ0FnSURRdXZhZHBRRRAB,"The restaurants environment its self is  decidedly engaging,  beautiful decorated, and clean. Koultures menu is colourful with ethnic dishes from Ethiopia and Nigeria to suit any palette.
BUT
The food takes a ridiculously long time to arrive. When I ordered I waited over an hour for an APPETIZER and when it arrived it was the wrong order, now I couldve asked to send it back but I didnt see the point as it wouldve taken another hour for the order to arrive.",2,4/29/2018 3:47
1196,Edmonton,Koultures Afro-Continental Restaurant,287,3.7,ChZDSUhNMG9nS0VJQ0FnSUNDeWNPQkVnEAE,Food Service and customer service are poor. They say they cater to Nigerians and ethiopians but they really cater for the ethiopians. And they take a long time to bring the order. They don't do substitutions. If they run out of a side dish you will pay full price if you don't mention something in place of the missing items. I would suggest to go somewhere else.,1,8/27/2020 17:10
1197,Edmonton,Koultures Afro-Continental Restaurant,287,3.7,ChdDSUhNMG9nS0VJQ0FnSUNld0x5M3pRRRAB,"Tonight I had the egusi with goat, fufu & jollof rice. Everything tasted wonderful and the service was amazing! I will definitely be back",5,9/3/2022 4:30
1198,Edmonton,Koultures Afro-Continental Restaurant,287,3.7,ChZDSUhNMG9nS0VJQ0FnSUNRMjdHTld3EAE,"Terrible service that matches the bad food. We waited over an hour for our meal. They totally forgot the coffee I ordered, it was almost impossible to get a waitress. when the food finally came out it was so underwhelming. The beans were either too spicy or not spicy enough . The lamb was under cooked. The rice and vegetables plain. They didn't have any of the coffee drinks on their menu other than basic filter coffee. We were so disappointed from the food that took extremely too long to show up.",1,10/1/2017 2:40
1199,Edmonton,Koultures Afro-Continental Restaurant,287,3.7,ChZDSUhNMG9nS0VJQ0FnSUNDM05lU1pnEAE,"I came here for the first time almost two weeks ago and really enjoyed the vegetarian combo. The shiro wat and misir wat were excellent! ?????? I look forward to coming again. Next time, I will try some of the Nigerian dishes! ??",5,8/15/2020 19:22
1200,Edmonton,Koultures Afro-Continental Restaurant,287,3.7,ChdDSUhNMG9nS0VJQ0FnSURnczdDa2p3RRAB,"Food was good but I didn't like the fact that towards the end of my meal, the place was filled with some kind of smoke/incense that was intentionally diffused for the pleasure of other customers..  I had to leave the place in a hurry after that. Please consider the comfort of ALL  your guests. I loved the music though.",4,2/6/2018 20:01
1201,Edmonton,Koultures Afro-Continental Restaurant,287,3.7,ChdDSUhNMG9nS0VJQ0FnSUN3ODltV3RBRRAB,"Great choice of Ethiopian and Nigerian food,  taste is amazing and staff are friendly. Good choice for a quick lunch or dinner that does not require dressing up and vibe is more upbeat with latest hits playing in the background. I especially recommend for the Nigerian dishes.",5,5/5/2018 23:47
1202,Edmonton,Koultures Afro-Continental Restaurant,287,3.7,ChZDSUhNMG9nS0VJQ0FnSURRcWNUWFhREAE,"Went there for the first time tonight and loved it! Excellent food, friendly and informative service, a casually quiet non-rushed dining experience. We were able to have a great conversation, eat with our hands, and enjoy a lovely coffee after (which they roast and bring the beans to the table for you to sleep!) This place should definitely be busier!",5,2/25/2018 2:08
1203,Edmonton,Koultures Afro-Continental Restaurant,287,3.7,ChZDSUhNMG9nS0VJQ0FnSURleGNyM1F3EAE,Thank you for accommodating all 15 of  us. We came all the way from Toronto for this amazing home experience. We will be back,5,10/15/2022 1:28
1204,Edmonton,Koultures Afro-Continental Restaurant,287,3.7,ChZDSUhNMG9nS0VJQ0FnSUQwek9YV2F3EAE,"Bad service, trash food. As a matter of fact, they don't deserve 1 star. I simply asked a lady on phone if my order will be ready in 15 minutes, and she snapped and told me in a very rude way that she was busy. Made me wonder if i was going to pay for her services or not. They also served me burnt tilapia fish twice.",1,10/26/2019 1:58
1205,Edmonton,Koultures Afro-Continental Restaurant,287,3.7,ChdDSUhNMG9nS0VJQ0FnSUR1bHVuVHF3RRAB,"This  restaurant is the worst restaurant Ive ever been too  . we waited for one hour and decided to leave after ,  they didnt even apologize to us  . I will not recommend this restaurant to anyone, dont waste your time .",1,8/20/2022 4:33
1206,Edmonton,Koultures Afro-Continental Restaurant,287,3.7,ChdDSUhNMG9nS0VJQ0FnSUNBOXAyWXB3RRAB,"I recently had the most amazing meal there with some colleagues from the office. Goat meat, rice, spinach and fufu. All prepared promptly and delicious. It tasted just like home. I am going there tomorrow again. Does anyone want to join me?",5,12/13/2017 18:30
1207,Edmonton,Koultures Afro-Continental Restaurant,287,3.7,ChZDSUhNMG9nS0VJQ0FnSUN3Xzd2YmZREAE,I gave a 5 star even though it was my first time there yesterday. The food and service was excellent although I couldnt get my small chops cause the kitchen had closed by the time I got there??.. All the same excellent place to eat and listen to Nigeria songs which reminds me of home ??. One more thing if you can get online delivery that will be great,5,10/17/2018 23:14
1208,Edmonton,Koultures Afro-Continental Restaurant,287,3.7,ChZDSUhNMG9nS0VJQ0FnSURxNDQ2RVFBEAE,"We really enjoyed the Ethiopian cultural spicy food. Beside that  the typical Ethiopian instrumental music brought me old memories from back home.
Keep it up!",5,7/15/2021 5:39
1209,Edmonton,Koultures Afro-Continental Restaurant,287,3.7,ChZDSUhNMG9nS0VJQ0FnSUNRemV2TkZBEAE,"Nice warm African delicacies, prepared fresh so you have to wait between 15 to 20minutes to get served. But you can reduce the waiting time by calling ahead to place your order before arriving the restaurant. Also plays current Nigerian Music.",4,11/19/2017 21:34
1210,Edmonton,Koultures Afro-Continental Restaurant,287,3.7,ChdDSUhNMG9nS0VJQ0FnSURpaGNXeV9RRRAB,"The food is alright but the guy we met today was just rude as he'll, the air quality in there was terrible and when we mentioned it to him he got salty and was rude. He was even choking funny enough, not a place for people with respiratory problems. Terrible service today ?? very unimpressed tsk tsk.",1,7/21/2021 2:43
1211,Edmonton,Koultures Afro-Continental Restaurant,287,3.7,ChZDSUhNMG9nS0VJQ0FnSUNScmFiNk9nEAE,Scam. Cheat. Inedible,1,4/25/2023 1:52
1212,Edmonton,Koultures Afro-Continental Restaurant,287,3.7,ChZDSUhNMG9nS0VJQ0FnSUNLaU1pQ1ZBEAE,"Food was delicious but portion were ever small as if they were feeding birds. Very disappointed!!!
Ordered online and was missing an order.
Please work on your customer service and PORTION!!!!!!! 24 bucks for literally nothing on your plate!",1,3/26/2021 0:21
1213,Edmonton,Koultures Afro-Continental Restaurant,287,3.7,ChdDSUhNMG9nS0VJQ0FnSUN5MHFmSGdRRRAB,"Selection is amazing.  The food was delicious.  Having never tried Nigerian food, I asked for recommendations. The lady who helped selected a great meal.",5,1/25/2021 2:59
1214,Edmonton,Koultures Afro-Continental Restaurant,287,3.7,ChdDSUhNMG9nS0VJQ0FnSUNDeWNpNm9nRRAB,"They may be great with other African meals but the Nigerian dishes are not worth it. Also, I was charged $25 for a plate of food that had no meat. Terrible!",1,11/3/2020 13:47
1215,Edmonton,Koultures Afro-Continental Restaurant,287,3.7,ChdDSUhNMG9nS0VJQ0FnSURta3IzWHNRRRAB,"Said its open 10am on sundays posted on their door however I followed the 12pm open time on Sundays on Google. Arrive at 12:30 today and closed up, completely dark inside.",1,1/23/2022 19:26
1216,Edmonton,Koultures Afro-Continental Restaurant,287,3.7,ChZDSUhNMG9nS0VJQ0FnSUQtN183M1hnEAE,"The experience here was good, the food is good but the prices are too high.",3,12/13/2022 3:07
1217,Edmonton,Koultures Afro-Continental Restaurant,287,3.7,ChZDSUhNMG9nS0VJQ0FnSURNclpiUlh3EAE,What a bad experience we had! We came in and not even a hello or anything we then asked to see the menu and the guy just stared doesnt offer us to sit down or anything we then were deciding it was 6:30pm and he goes look I close at 8pm! The service was so bad and we felt so unwelcomed that we left! Strongly recommend not going here if your looking to even get serviced what a huge disappointment!,1,1/8/2020 6:22
1218,Edmonton,Koultures Afro-Continental Restaurant,287,3.7,ChdDSUhNMG9nS0VJQ0FnSUN3MGNTSnVnRRAB,"Wonderful place and if you haven't tried African food you should do it here. Food was very good, made with fresh ingredients and the restaraunt and bathrooms were very clean. Our server David was excellent.",5,9/5/2018 20:45
1219,Edmonton,Koultures Afro-Continental Restaurant,287,3.7,ChZDSUhNMG9nS0VJQ0FnSURvX19qWkxREAE,"We ordered on three different occasions and each time our order was wrong. Last time I visited there I requested receipt for my meal, the waiter said to me we run out of paper. I cant give u receipt ""take the food or leave it"".",1,3/28/2019 0:58
1220,Edmonton,Koultures Afro-Continental Restaurant,287,3.7,ChdDSUhNMG9nS0VJQ0FnSUMyNXRIczhBRRAB,I love ordering at koultures because its absolutely delicious but they barely pick up peoples calls and my skip the dishes orders are always canceled ??.,3,4/19/2022 18:30
1221,Edmonton,Koultures Afro-Continental Restaurant,287,3.7,ChdDSUhNMG9nS0VJQ0FnSURRdWNMbW5RRRAB,"I think this place is one of the decent Dinning ethiopian and  eritrean Restaurants in town . The place is clean , well decorated and very bright . The food was delicious.  I enjoyed dinning there . The server (Nina ) was kind of shy , however she  did her best . .. i would recommend to anyone",5,4/19/2018 0:26
1222,Edmonton,Koultures Afro-Continental Restaurant,287,3.7,ChdDSUhNMG9nS0VJQ0FnSURBNk1PRmpBRRAB,"I was in Edmonton during the weekend, and I was starving for an African food. I met an Uber driver that took me to this restaurant outside the university hospital I was staying. The food here was fantastic and the palmy was too good. I met the cook Chukwudi - a young promising man, and the Ethiopian madam. They were professional with there services , and I had wished for a similar restaurant like this one in Prince George, BC. Thank you guys and hope to see you again on my way to Saskatchewan.",5,4/15/2018 5:30
1223,Edmonton,Koultures Afro-Continental Restaurant,287,3.7,ChZDSUhNMG9nS0VJQ0FnSUNROWQ2YWF3EAE,"Good waiters, lively atmosphere. Decent meal for the first few times we came, but things got ruined on the 3rd visit with sour rice dishes. Dissappointed.",2,11/24/2017 2:42
1224,Edmonton,Koultures Afro-Continental Restaurant,287,3.7,ChZDSUhNMG9nS0VJQ0FnSUMwa2JUQld3EAE,I went to this place today and we waited 1 hour for our food which was fine with us because we love their food. They didnt offer drinks and ignored us when we asked for water. Service was terrible. They should hire more people to serve.,1,9/29/2019 23:55
1225,Edmonton,Koultures Afro-Continental Restaurant,287,3.7,ChdDSUhNMG9nS0VJQ0FnSUN1cDQtNGdBRRAB,"Took THREE HOURS to get our order food was average, however I do not recommend",2,8/8/2022 4:28
1226,Edmonton,Koultures Afro-Continental Restaurant,287,3.7,ChZDSUhNMG9nS0VJQ0FnSUN3MGZuZklREAE,"As In, omo mehn. It has been long since I have had Naija food sha. Anyhow. It was a rainy day that day, so Nigerian pepper soup was a good idea at the time. When we got to Koultures, they served us pepper soup in a calabash. It brought the African feel, and it tasted great too. And the Jollof rice made sense too. Good stuff. Did I also mention that the restaurant looks good. Red tablecloths, and such.",4,8/9/2016 20:07
1227,Edmonton,Koultures Afro-Continental Restaurant,287,3.7,ChdDSUhNMG9nS0VJQ0FnSUNCczV2WHp3RRAB,Ate some goat meat and got a nice tuggy out back. Will be coming back soon,5,1/4/2023 0:23
1228,Edmonton,Koultures Afro-Continental Restaurant,287,3.7,ChdDSUhNMG9nS0VJQ0FnSUNoNS15TmdnRRAB,The Jollof rice with  goat meat was great,5,2/24/2023 2:10
1229,Edmonton,Koultures Afro-Continental Restaurant,287,3.7,ChdDSUhNMG9nS0VJQ0FnSUMwc1BEV2tnRRAB,"now this place is something different if u have never tried any Ethiopian or Eritrean cultural food, this is the place to go, everything you eat there is Organic and freshly made and they serve it hot and you start kicking it, and if u can't finish it u can take it home, warm it and again indulge it and it still tests fresh, and they serve spicy and non spicy. go and try something new.",5,9/11/2019 21:21
1230,Edmonton,Koultures Afro-Continental Restaurant,287,3.7,ChdDSUhNMG9nS0VJQ0FnSUN5Z05hOV9BRRAB,"Service was great and the food was really natural and delicious!
I highly recommend this superb restaurant, if you really want to taste
great food with amazing services !",5,1/15/2021 5:14
1231,Edmonton,Koultures Afro-Continental Restaurant,287,3.7,ChZDSUhNMG9nS0VJQ0FnSURTdmN6RlhnEAE,Your food taste good but apparently the price is unnecessarily expensive compared to the same bowl of rice and few piece of beef in other african and Chinese restaurants,3,1/5/2021 23:49
1232,Edmonton,Koultures Afro-Continental Restaurant,287,3.7,ChZDSUhNMG9nS0VJQ0FnSURRXzl2YVRREAE,"Had lunch at this restaurant for the first time.  It was very good, the food was delicious, the restaurant was clean, The attendant Christine was very pleasant and help me to choose what I wanted to eat. It was a pleasant experience.",4,6/20/2015 19:37
1233,Edmonton,Koultures Afro-Continental Restaurant,287,3.7,ChdDSUhNMG9nS0VJQ0FnSUNBa3FpWHdnRRAB,"Good customer and food services. I enjoyed my meal. I ordered for poundo yam with vegetables and egusi, moinmoin, plantain, goatmeat, assorted meat, tilapia fish and pepper soup for my family.",4,6/3/2018 3:52
1234,Edmonton,Koultures Afro-Continental Restaurant,287,3.7,ChdDSUhNMG9nS0VJQ0FnSURTLWVmdWpRRRAB,"Food is not worth how much they charge, ordered food for $60 I literally got 20 bucks worth of food, they are charging $16 for a whole talapia but then charge $16 only for one slice of king fish? Yeah last time for me",1,1/2/2021 1:01
1235,Edmonton,Koultures Afro-Continental Restaurant,287,3.7,ChZDSUhNMG9nS0VJQ0FnSUNDdksyNUN3EAE,The best ethiopian food ive ever had! The food and drinks came quick. Customer service is great as well. Highly recommend!,5,8/16/2020 2:38
1236,Edmonton,Koultures Afro-Continental Restaurant,287,3.7,ChdDSUhNMG9nS0VJQ0FnSURRenBfSWhBRRAB,The food was a little slow and the decor is... interesting (bright neon pink on black!) but the food tastes delicious! We'll definitely be back.,4,7/7/2013 2:59
1237,Edmonton,Koultures Afro-Continental Restaurant,287,3.7,ChdDSUhNMG9nS0VJQ0FnSURXak15dXdRRRAB,should specify if there is pork in a meal because its a very common dietary restriction. specify in general what youre selling.,2,3/16/2022 22:16
1238,Edmonton,Koultures Afro-Continental Restaurant,287,3.7,ChdDSUhNMG9nS0VJQ0FnSUNXazR1d2hBRRAB,"The food was delicious!

Will definitely visit again.",5,9/27/2022 13:36
1239,Edmonton,Koultures Afro-Continental Restaurant,287,3.7,ChdDSUhNMG9nS0VJQ0FnSURDclBUOXJ3RRAB,The food is delicious I tried both east and west African dishes I highly recommend this place koultres restaurant.??????????,5,9/17/2020 14:46
